"Epic","Feature","Story","FAILED","BROKEN","PASSED","SKIPPED","UNKNOWN"
"","","","0","0","6","0","0"
"Playwright Bekleme Stratejileri","Wait Management","Tüm Bekleme Türlerinin Tek Senaryoda Kullanımı","0","0","1","0","0"
"Kullanıcı Yönetimi","Uçtan Uca Üyelik Döngüsü","Kullanıcı Kaydı ve Hesap Silme","0","0","1","0","0"
"Görsel Kayıt Sistemleri","Video Kayıt Özelliği","Kullanıcı tarayıcı işlemlerini videoya alabilmeli","0","0","2","0","0"
"Web Element Etkileşimleri","Scroll ve Görünürlük Yönetimi","Sayfa İçi Kaydırma ve Element Odaklanma Teknikleri","0","0","1","0","0"
"Kullanıcı Yönetimi","Üyelik İşlemleri","Kullanıcı yeni hesap oluşturabilmeli ve oluşturduğu hesabı silebilmeli","0","0","1","0","0"
"Web Element Etkileşimleri","Scroll ve Görünürlük Yönetimi - V1","Metod Notasyonları ile Sayfa Kaydırma Teknikleri","0","0","1","0","0"
"Playwright Bekleme Stratejileri","Wait Management - V1","allureStep Kancası ile Bekleme Yönetimi","0","0","1","0","0"
